<?xml version="1.0" encoding="UTF-8"?>
<!-- 
	Sample configuration file.
-->
<ceppushsvc-configuration xmlns:xsi="http://www.w3.org/2001/XMLSchema-instance" xmlns="http://www.espertech.com/schema/esperceppushsvc" xsi:noNamespaceSchemaLocation="ceppushsvc-configuration-5-0.xsd">
	<subjectspaces>
		<subjectspace name="defaultSpace"/>
	</subjectspaces>

	<channels>
		<channel name="defaultChannel" subjectspace="defaultSpace">
			<qos>
				<batched-service interval-msec="1000"/>
			</qos>
			<jms>
				<destination topic="esper.data.default"/>
			</jms>
		</channel>
	</channels>

	<providers>
		<provider name="defaultProvider">
			<context object-name="ConnectionFactory">
				<env name="java.naming.factory.initial" value="org.apache.activemq.jndi.ActiveMQInitialContextFactory"/>
				<env name="java.naming.provider.url" value="tcp://localhost:61616?wireFormat.maxInactivityDuration=0"/>
				<env name="java.naming.security.principal" value=""/>
				<env name="java.naming.security.credentials" value=""/>
			</context>
		</provider>
	</providers>
	
	<settings>
		<pushprovider provider-name="defaultProvider"/>
		<session-mgmt enabled="false" interval-msec="10000" expiry-msec="60000"/>
	</settings>
	
</ceppushsvc-configuration>
